{"handoff_id":"handoff-history","dossier_id":"case-dossier-1","from_run_id":"case-run-1","to_actor_id":"actor-history","basis_revision":"8","basis_state_digest":"sha256:5555555555555555555555555555555555555555555555555555555555555555","published_revision":"9","offered_content_digest":"sha256:6666666666666666666666666666666666666666666666666666666666666666","created_operation_id":"op-handoff-history"}
